{
  "schema_version": "1.1",
  "id": "ti-soic8",
  "revision": "1.0",
  "effective_date": "2026-10-07",
  "validation_status": "APPROVED",
  "content_sha256": "6547396d4321d44aebbf7307254479d7521bd04af22b7ae73da375e73aeca158",
  "release_profile": {
    "id": "mvp-1",
    "version": "1.1",
    "sha256": "4fd985b0dda18fdc2bdb0bcd7f64bb36492fa3b19b2a0de29c181d2508b8764f"
  },
  "identity": {
    "family": "small_outline_ic",
    "variant": "SOIC-8",
    "scope": "MANUFACTURER_SPECIFIC",
    "manufacturer": "Texas Instruments",
    "manufacturer_package_code": "D0008A",
    "peripheral_lead_count": 8,
    "exposed_terminal_count": 0,
    "pin_count": 8
  },
  "mechanical": {
    "body": {
      "length": {
        "nominal_mm": 3.895,
        "minimum_mm": 3.81,
        "maximum_mm": 3.98,
        "source_ids": [
          "SRC-MANUFACTURER"
        ]
      },
      "width": {
        "nominal_mm": 4.905,
        "minimum_mm": 4.81,
        "maximum_mm": 5,
        "source_ids": [
          "SRC-MANUFACTURER"
        ]
      },
      "height": {
        "nominal_mm": 1.575,
        "minimum_mm": 1.575,
        "maximum_mm": 1.575,
        "source_ids": [
          "SRC-MODEL-POLICY"
        ]
      }
    },
    "terminal": {
      "length": {
        "nominal_mm": 1.05,
        "minimum_mm": 1.05,
        "maximum_mm": 1.05,
        "source_ids": [
          "SRC-MODEL-POLICY"
        ]
      },
      "width": {
        "nominal_mm": 0.41,
        "minimum_mm": 0.41,
        "maximum_mm": 0.41,
        "source_ids": [
          "SRC-MODEL-POLICY"
        ]
      },
      "height": {
        "nominal_mm": 0.65,
        "minimum_mm": 0.65,
        "maximum_mm": 0.65,
        "source_ids": [
          "SRC-MODEL-POLICY"
        ]
      }
    },
    "terminals": [
      {
        "terminal_id": "T-1",
        "length": {
          "nominal_mm": 1.05,
          "minimum_mm": 1.05,
          "maximum_mm": 1.05,
          "source_ids": [
            "SRC-MODEL-POLICY"
          ]
        },
        "width": {
          "nominal_mm": 0.41,
          "minimum_mm": 0.41,
          "maximum_mm": 0.41,
          "source_ids": [
            "SRC-MODEL-POLICY"
          ]
        },
        "height": {
          "nominal_mm": 0.65,
          "minimum_mm": 0.65,
          "maximum_mm": 0.65,
          "source_ids": [
            "SRC-MODEL-POLICY"
          ]
        }
      },
      {
        "terminal_id": "T-2",
        "length": {
          "nominal_mm": 1.05,
          "minimum_mm": 1.05,
          "maximum_mm": 1.05,
          "source_ids": [
            "SRC-MODEL-POLICY"
          ]
        },
        "width": {
          "nominal_mm": 0.41,
          "minimum_mm": 0.41,
          "maximum_mm": 0.41,
          "source_ids": [
            "SRC-MODEL-POLICY"
          ]
        },
        "height": {
          "nominal_mm": 0.65,
          "minimum_mm": 0.65,
          "maximum_mm": 0.65,
          "source_ids": [
            "SRC-MODEL-POLICY"
          ]
        }
      },
      {
        "terminal_id": "T-3",
        "length": {
          "nominal_mm": 1.05,
          "minimum_mm": 1.05,
          "maximum_mm": 1.05,
          "source_ids": [
            "SRC-MODEL-POLICY"
          ]
        },
        "width": {
          "nominal_mm": 0.41,
          "minimum_mm": 0.41,
          "maximum_mm": 0.41,
          "source_ids": [
            "SRC-MODEL-POLICY"
          ]
        },
        "height": {
          "nominal_mm": 0.65,
          "minimum_mm": 0.65,
          "maximum_mm": 0.65,
          "source_ids": [
            "SRC-MODEL-POLICY"
          ]
        }
      },
      {
        "terminal_id": "T-4",
        "length": {
          "nominal_mm": 1.05,
          "minimum_mm": 1.05,
          "maximum_mm": 1.05,
          "source_ids": [
            "SRC-MODEL-POLICY"
          ]
        },
        "width": {
          "nominal_mm": 0.41,
          "minimum_mm": 0.41,
          "maximum_mm": 0.41,
          "source_ids": [
            "SRC-MODEL-POLICY"
          ]
        },
        "height": {
          "nominal_mm": 0.65,
          "minimum_mm": 0.65,
          "maximum_mm": 0.65,
          "source_ids": [
            "SRC-MODEL-POLICY"
          ]
        }
      },
      {
        "terminal_id": "T-5",
        "length": {
          "nominal_mm": 1.05,
          "minimum_mm": 1.05,
          "maximum_mm": 1.05,
          "source_ids": [
            "SRC-MODEL-POLICY"
          ]
        },
        "width": {
          "nominal_mm": 0.41,
          "minimum_mm": 0.41,
          "maximum_mm": 0.41,
          "source_ids": [
            "SRC-MODEL-POLICY"
          ]
        },
        "height": {
          "nominal_mm": 0.65,
          "minimum_mm": 0.65,
          "maximum_mm": 0.65,
          "source_ids": [
            "SRC-MODEL-POLICY"
          ]
        }
      },
      {
        "terminal_id": "T-6",
        "length": {
          "nominal_mm": 1.05,
          "minimum_mm": 1.05,
          "maximum_mm": 1.05,
          "source_ids": [
            "SRC-MODEL-POLICY"
          ]
        },
        "width": {
          "nominal_mm": 0.41,
          "minimum_mm": 0.41,
          "maximum_mm": 0.41,
          "source_ids": [
            "SRC-MODEL-POLICY"
          ]
        },
        "height": {
          "nominal_mm": 0.65,
          "minimum_mm": 0.65,
          "maximum_mm": 0.65,
          "source_ids": [
            "SRC-MODEL-POLICY"
          ]
        }
      },
      {
        "terminal_id": "T-7",
        "length": {
          "nominal_mm": 1.05,
          "minimum_mm": 1.05,
          "maximum_mm": 1.05,
          "source_ids": [
            "SRC-MODEL-POLICY"
          ]
        },
        "width": {
          "nominal_mm": 0.41,
          "minimum_mm": 0.41,
          "maximum_mm": 0.41,
          "source_ids": [
            "SRC-MODEL-POLICY"
          ]
        },
        "height": {
          "nominal_mm": 0.65,
          "minimum_mm": 0.65,
          "maximum_mm": 0.65,
          "source_ids": [
            "SRC-MODEL-POLICY"
          ]
        }
      },
      {
        "terminal_id": "T-8",
        "length": {
          "nominal_mm": 1.05,
          "minimum_mm": 1.05,
          "maximum_mm": 1.05,
          "source_ids": [
            "SRC-MODEL-POLICY"
          ]
        },
        "width": {
          "nominal_mm": 0.41,
          "minimum_mm": 0.41,
          "maximum_mm": 0.41,
          "source_ids": [
            "SRC-MODEL-POLICY"
          ]
        },
        "height": {
          "nominal_mm": 0.65,
          "minimum_mm": 0.65,
          "maximum_mm": 0.65,
          "source_ids": [
            "SRC-MODEL-POLICY"
          ]
        }
      }
    ]
  },
  "topology": {
    "pitch_mm": 1.27,
    "numbering": "COUNTER_CLOCKWISE",
    "pin1_location": "WEST",
    "stagger": false,
    "sides": {
      "north": 0,
      "east": 4,
      "south": 0,
      "west": 4,
      "center": 0
    },
    "terminals": [
      {
        "id": "T-1",
        "number": "1",
        "kind": "PERIPHERAL",
        "side": "west",
        "topology_index": 0,
        "group_id": "G-1"
      },
      {
        "id": "T-2",
        "number": "2",
        "kind": "PERIPHERAL",
        "side": "west",
        "topology_index": 1,
        "group_id": "G-2"
      },
      {
        "id": "T-3",
        "number": "3",
        "kind": "PERIPHERAL",
        "side": "west",
        "topology_index": 2,
        "group_id": "G-3"
      },
      {
        "id": "T-4",
        "number": "4",
        "kind": "PERIPHERAL",
        "side": "west",
        "topology_index": 3,
        "group_id": "G-4"
      },
      {
        "id": "T-5",
        "number": "5",
        "kind": "PERIPHERAL",
        "side": "east",
        "topology_index": 0,
        "group_id": "G-5"
      },
      {
        "id": "T-6",
        "number": "6",
        "kind": "PERIPHERAL",
        "side": "east",
        "topology_index": 1,
        "group_id": "G-6"
      },
      {
        "id": "T-7",
        "number": "7",
        "kind": "PERIPHERAL",
        "side": "east",
        "topology_index": 2,
        "group_id": "G-7"
      },
      {
        "id": "T-8",
        "number": "8",
        "kind": "PERIPHERAL",
        "side": "east",
        "topology_index": 3,
        "group_id": "G-8"
      }
    ]
  },
  "land_pattern": {
    "source": "MANUFACTURER_RECOMMENDED",
    "groups": [
      {
        "id": "G-1",
        "terminal_number": "1",
        "shapes": [
          {
            "id": "PAD-1",
            "shape": "RECT",
            "center_mm": [
              -2.7,
              1.905
            ],
            "size_mm": [
              1.55,
              0.6
            ]
          }
        ]
      },
      {
        "id": "G-2",
        "terminal_number": "2",
        "shapes": [
          {
            "id": "PAD-2",
            "shape": "RECT",
            "center_mm": [
              -2.7,
              0.635
            ],
            "size_mm": [
              1.55,
              0.6
            ]
          }
        ]
      },
      {
        "id": "G-3",
        "terminal_number": "3",
        "shapes": [
          {
            "id": "PAD-3",
            "shape": "RECT",
            "center_mm": [
              -2.7,
              -0.635
            ],
            "size_mm": [
              1.55,
              0.6
            ]
          }
        ]
      },
      {
        "id": "G-4",
        "terminal_number": "4",
        "shapes": [
          {
            "id": "PAD-4",
            "shape": "RECT",
            "center_mm": [
              -2.7,
              -1.905
            ],
            "size_mm": [
              1.55,
              0.6
            ]
          }
        ]
      },
      {
        "id": "G-5",
        "terminal_number": "5",
        "shapes": [
          {
            "id": "PAD-5",
            "shape": "RECT",
            "center_mm": [
              2.7,
              -1.905